<?xml version="1.0" encoding="UTF-8" standalone="no"?>

<xs:schema xmlns:xs="http://www.w3.org/2001/XMLSchema">
  <xs:element name="Empleados">
    <xs:complexType>
      <xs:sequence>
        <xs:element name="Empleado" maxOccurs="unbounded" minOccurs="0">
          <xs:complexType>
            <xs:sequence>
              <xs:element type="xs:string" name="nif"/>
              <xs:element type="xs:string" name="Nombre"/>
              <xs:element type="xs:string" name="Apellido1"/>
              <xs:element type="xs:string" name="Apellido2"/>
              <xs:element type="xs:string" name="cuenta"/>
              <xs:element type="xs:date" name="Antigüedad"/>
              <xs:element type="xs:string" name="N._de_afiliación_a_la_Seguridad_Social"/>
              <xs:element type="xs:string" name="Categoría-Grupo_profesional"/>
              <xs:element type="xs:byte" name="Grupo_Cotización"/>
              <xs:element type="xs:string" name="email"/>
              <xs:element type="xs:string" name="departamento"/>
            </xs:sequence>
          </xs:complexType>
        </xs:element>
      </xs:sequence>
    </xs:complexType>
  </xs:element>
</xs:schema>